[
  {
    "id": "a0000000-0000-0000-0000-000000000101",
    "assetCode": "AST-TRK-DEL-412",
    "name": "Track KM 412 Down Main",
    "assetType": "TRACK",
    "location": "KM 412/12-14 near Aligarh",
    "lineSection": "DEL-KNP Down Line",
    "latitude": 27.8974,
    "longitude": 78.088,
    "status": "OPERATIONAL",
    "department": "ENGINEERING",
    "sourceSystem": "TMS",
    "sourceRecordId": "TMS-AST-412",
    "ingestedAt": "2026-09-24T00:00:00Z",
    "updatedAt": "2026-09-24T00:00:00Z"
  },
  {
    "id": "a0000000-0000-0000-0000-000000000102",
    "assetCode": "AST-SIG-DEL-S42",
    "name": "Electronic Interlocking Signal S-42",
    "assetType": "SIGNAL",
    "location": "KM 412/10 Aligarh Outer",
    "lineSection": "DEL-KNP Main Line",
    "latitude": 27.898,
    "longitude": 78.089,
    "status": "MAINTENANCE_REQUIRED",
    "department": "SIGNAL_TELECOMMUNICATION",
    "sourceSystem": "SMMS",
    "sourceRecordId": "SMMS-SIG-892",
    "ingestedAt": "2026-09-24T00:00:00Z",
    "updatedAt": "2026-09-24T00:00:00Z"
  },
  {
    "id": "a0000000-0000-0000-0000-000000000103",
    "assetCode": "AST-OHE-DEL-C18",
    "name": "OHE Overhead Catenary Wire Cantilever 18",
    "assetType": "OHE",
    "location": "KM 412/15 Aligarh Yard",
    "lineSection": "DEL-KNP Electrified Track",
    "latitude": 27.8965,
    "longitude": 78.087,
    "status": "OPERATIONAL",
    "department": "TRACTION",
    "sourceSystem": "TDMS",
    "sourceRecordId": "TDMS-OHE-412",
    "ingestedAt": "2026-09-24T00:00:00Z",
    "updatedAt": "2026-09-24T00:00:00Z"
  },
  {
    "id": "a0000000-0000-0000-0000-000000000104",
    "assetCode": "AST-TRK-HWH-J90",
    "name": "Insulated Rail Joint J-90 Dhanbad Yard",
    "assetType": "TRACK",
    "location": "KM 265/04 Dhanbad Chord",
    "lineSection": "HWH-DHN Chord",
    "latitude": 23.7957,
    "longitude": 86.4304,
    "status": "DEFECTIVE",
    "department": "ENGINEERING",
    "sourceSystem": "SMMS",
    "sourceRecordId": "SMMS-TRK-771",
    "ingestedAt": "2026-09-24T00:00:00Z",
    "updatedAt": "2026-09-24T00:00:00Z"
  },
  {
    "id": "a0000000-0000-0000-0000-000000000105",
    "assetCode": "AST-TRK-LKO-S12",
    "name": "Track Section LKO-GD Spur KM 45",
    "assetType": "TRACK",
    "location": "KM 45/00 Barabanki Section",
    "lineSection": "LKO-GD Non-Electrified Spur",
    "latitude": 26.9272,
    "longitude": 81.1821,
    "status": "OPERATIONAL",
    "department": "ENGINEERING",
    "sourceSystem": "BDMS",
    "sourceRecordId": "BDMS-TRK-045",
    "ingestedAt": "2026-09-24T00:00:00Z",
    "updatedAt": "2026-09-24T00:00:00Z"
  },
  {
    "id": "a0000000-0000-0000-0000-000000000106",
    "assetCode": "AST-SWT-BPL-P09",
    "name": "Motorized Point Switch SW-09 Bhopal North",
    "assetType": "SWITCH",
    "location": "Bhopal Junction North Yard",
    "lineSection": "BPL-NGP Trunk",
    "latitude": 23.2599,
    "longitude": 77.4126,
    "status": "OPERATIONAL",
    "department": "SIGNAL_TELECOMMUNICATION",
    "sourceSystem": "SMMS",
    "sourceRecordId": "SMMS-SWT-509",
    "ingestedAt": "2026-09-24T00:00:00Z",
    "updatedAt": "2026-09-24T00:00:00Z"
  }
]
